{
  "$schema": "https://json-schema.org/draft/2020-12/schema",
  "config_id": "m15-dry-run-monitor-sources",
  "schema_version": "1.0.0-draft",
  "status": "DRAFT_NOT_ACTIVE",
  "verified_at": "2026-08-17T00:00:00+09:00",
  "activation_phase": "not_started",
  "candidate_change_types": [
    "RULE_CHANGE", "ELIGIBILITY_CHANGE", "PRICE_CHANGE", "CAMPAIGN_CHANGE",
    "PLAN_CHANGE", "PAYOUT_CHANGE", "SOURCE_CLARIFICATION", "CONTENT_ONLY"
  ],
  "safety_policy": {
    "master_auto_update_allowed": false,
    "sourcehealth_auto_update_allowed": false,
    "diagnosis_auto_update_allowed": false,
    "work_auto_apply_allowed": false,
    "site_auto_publish_allowed": false,
    "conflict_resolution_default": "human_only",
    "sourcehealth_resolution_requires_crosscheck": true,
    "human_review_default": true
  },
  "sources": [
    {
      "source_id": "DR01",
      "firm_id": "fintokei",
      "firm_name": "Fintokei",
      "url": "https://support.fintokei.com/ja/articles/12040973-速攻プロプランの各ステップにはどのようなルールがありますか",
      "source_type": "official_help",
      "source_priority": "A2",
      "watch_category": ["RULE", "PLAN", "EFFECTIVE_DATE", "LEGACY_VARIANT"],
      "frequency": "weekly",
      "critical_keywords": ["速攻プロ", "Profit Target", "利益目標", "Daily Loss", "日次損失", "Max Loss", "最大損失", "Minimum Trading Days", "最低取引日数", "2026年7月15日", "新規購入", "旧口座", "適用"],
      "ignore_patterns": ["cookie_banner", "support_widget", "breadcrumb_order", "related_article_order", "search_ui", "footer_layout", "tracking_query", "random_dom_id"],
      "sourcehealth_ids": ["SH_FINTOKEI_SWIFT"],
      "enabled": true,
      "dry_run_group": "primary",
      "human_review_required": true,
      "auto_publish_allowed": false,
      "sourcehealth_resolution_mode": "human_only",
      "auto_unblock_allowed": false,
      "extract_fields": ["profit_target", "daily_loss", "max_loss", "dd_type", "minimum_trading_days", "effective_from", "purchase_scope", "legacy_scope"],
      "numeric_diff": true,
      "effective_date_required": true,
      "legacy_variant_sensitive": true,
      "variant_protection": {"effective_from": "2026-07-15", "new_purchase_only": true, "legacy_account_separation_required": true, "evidence_required": true, "human_approval_required": true},
      "crosscheck_source_ids": [],
      "expected_language": ["ja"],
      "redirect_policy": "record_final_url_do_not_replace_config",
      "parser_profile": "fintokei_help_rules_v1",
      "notes": "日付境界、購入時期、新旧口座を1レコードに保持する。条件判定不能ならBlock継続。"
    },
    {
      "source_id": "DR02",
      "firm_id": "fintokei",
      "firm_name": "Fintokei",
      "url": "https://support.fintokei.com/ja/articles/6538820-fintokeiに参加できる条件はありますか",
      "source_type": "official_help",
      "source_priority": "A2",
      "watch_category": ["ELIGIBILITY", "COUNTRY", "AGE"],
      "frequency": "weekly",
      "critical_keywords": ["参加条件", "制限国", "利用できない国", "一時的な制限", "新規購入", "日本", "Japan", "18歳", "年齢", "payout"],
      "ignore_patterns": ["cookie_banner", "support_widget", "breadcrumb_order", "related_article_order", "footer_layout", "tracking_query", "random_dom_id", "navigation"],
      "sourcehealth_ids": ["SH_FINTOKEI_ELIGIBILITY"],
      "enabled": true,
      "dry_run_group": "primary",
      "human_review_required": true,
      "auto_publish_allowed": false,
      "sourcehealth_resolution_mode": "human_only",
      "auto_unblock_allowed": false,
      "extract_fields": ["service_unavailable_countries", "temporary_restriction_countries", "new_purchase_restricted_countries", "japan_present", "minimum_age", "payout_jurisdiction_note"],
      "country_set_diff": true,
      "effective_date_required": true,
      "legacy_variant_sensitive": true,
      "crosscheck_source_ids": [],
      "expected_language": ["ja"],
      "redirect_policy": "record_final_url_do_not_replace_config",
      "parser_profile": "fintokei_help_eligibility_v1",
      "notes": "国は全文比較ではなくadded_countries／removed_countriesで保存する。日本の可否は自動公開しない。"
    },
    {
      "source_id": "DR03",
      "firm_id": "fundingpips",
      "firm_name": "FundingPips",
      "url": "https://help.fundingpips.com/hc/en-us/articles/44390730743825-Get-Started",
      "source_type": "official_help",
      "source_priority": "A2",
      "watch_category": ["PLAN", "ELIGIBILITY", "COUNTRY", "COUPON"],
      "frequency": "daily",
      "critical_keywords": ["trading models", "account sizes", "restricted countries", "18 years", "Japan", "coupon", "first purchase", "1 Step Flex", "2 Step Standard", "2 Step Flex", "2 Step Pro", "Zero"],
      "ignore_patterns": ["cookie_banner", "support_widget", "breadcrumb_order", "related_article_order", "search_ui", "footer_layout", "tracking_query", "random_dom_id", "navigation", "unrelated_blog_cards"],
      "sourcehealth_ids": ["SH011", "SH_FUNDINGPIPS_ELIGIBILITY"],
      "enabled": true,
      "dry_run_group": "primary",
      "human_review_required": true,
      "auto_publish_allowed": false,
      "sourcehealth_resolution_mode": "human_only",
      "auto_unblock_allowed": false,
      "extract_fields": ["trading_models", "account_sizes", "restricted_countries", "minimum_age", "first_purchase_coupon_code", "first_purchase_coupon_effect", "first_purchase_coupon_exclusions"],
      "country_set_diff": true,
      "numeric_diff": true,
      "effective_date_required": true,
      "legacy_variant_sensitive": true,
      "crosscheck_source_ids": [],
      "expected_language": ["en"],
      "redirect_policy": "record_final_url_do_not_replace_config",
      "parser_profile": "fundingpips_help_get_started_v1",
      "notes": "Coupon差分をRULE_CHANGEに昇格しない。SH011のHelp概要／詳細差は自動解消しない。"
    },
    {
      "source_id": "DR04",
      "firm_id": "the5ers",
      "firm_name": "The5ers",
      "url": "https://the5ers.com/promotions/",
      "source_type": "official_promotion",
      "source_priority": "A4",
      "watch_category": ["CAMPAIGN", "PRICE", "PLAN"],
      "frequency": "daily",
      "critical_keywords": ["promotion", "promotion name", "discount", "%", "valid until", "expiry", "program", "redeem"],
      "ignore_patterns": ["cookie_banner", "testimonial", "subscriber_form", "social_block", "footer_navigation", "copyright_year", "tracking_query", "random_dom_id", "unrelated_blog_cards"],
      "sourcehealth_ids": ["SH_THE5ERS_CAMPAIGN"],
      "enabled": true,
      "dry_run_group": "primary",
      "human_review_required": true,
      "auto_publish_allowed": false,
      "sourcehealth_resolution_mode": "human_only",
      "auto_unblock_allowed": false,
      "extract_fields": ["promotion_name", "discount_percent", "program", "valid_until", "redeem_target"],
      "numeric_diff": true,
      "effective_date_required": true,
      "legacy_variant_sensitive": true,
      "crosscheck_source_ids": [],
      "expected_language": ["en"],
      "redirect_policy": "record_final_url_do_not_replace_config",
      "parser_profile": "the5ers_promotions_v1",
      "notes": "掲載されているだけで有効とは判定しない。期限・対象・公式購入画面を人間確認する。"
    },
    {
      "source_id": "DR05",
      "firm_id": "hantec_trader",
      "firm_name": "Hantec Trader",
      "url": "https://help.htrader.hmarkets.com/en/support/solutions/articles/158000445802-instant-lite",
      "source_type": "official_help",
      "source_priority": "A2",
      "watch_category": ["RULE", "PLAN", "PAYOUT", "PLATFORM"],
      "frequency": "weekly",
      "critical_keywords": ["Instant Lite", "Profit Target", "Daily Loss", "Max Loss", "Maximum Loss", "trailing", "add-on", "payout", "weekend", "news", "EA", "copy trading", "reward split"],
      "ignore_patterns": ["cookie_banner", "support_widget", "breadcrumb_order", "related_article_order", "footer_layout", "tracking_query", "random_dom_id", "navigation"],
      "sourcehealth_ids": ["SH_HANTEC_INSTANT_LITE"],
      "enabled": true,
      "dry_run_group": "primary",
      "human_review_required": true,
      "auto_publish_allowed": false,
      "sourcehealth_resolution_mode": "human_only",
      "auto_unblock_allowed": false,
      "extract_fields": ["profit_target", "daily_loss", "max_total_loss", "dd_type", "minimum_profitable_days", "consistency", "payout_cycle", "reward_split", "weekend", "news", "ea", "add_on_max_loss_text"],
      "numeric_diff": true,
      "effective_date_required": true,
      "legacy_variant_sensitive": true,
      "crosscheck_source_ids": ["DR06"],
      "expected_language": ["en"],
      "redirect_policy": "record_final_url_do_not_replace_config",
      "parser_profile": "hantec_instant_lite_help_v1",
      "notes": "本文値とAdd-On値が矛盾してもConflictとして保存し、自動解消しない。"
    },
    {
      "source_id": "DR06",
      "firm_id": "hantec_trader",
      "firm_name": "Hantec Trader",
      "url": "https://htrader.hmarkets.com/jp/programs/instant-lite/",
      "source_type": "official_product",
      "source_priority": "A4",
      "watch_category": ["RULE", "PLAN", "PRICE", "ELIGIBILITY", "PAYOUT"],
      "frequency": "weekly",
      "critical_keywords": ["Instant Lite", "Max Loss", "Daily Loss", "add-on", "price", "payout", "Japan", "prohibited", "allowed"],
      "ignore_patterns": ["cookie_banner", "navigation", "footer", "tracking_query", "random_dom_id", "price_card_order_only"],
      "sourcehealth_ids": ["SH_HANTEC_INSTANT_LITE"],
      "enabled": false,
      "activation_phase": "phase_2",
      "dry_run_group": "shadow",
      "human_review_required": true,
      "auto_publish_allowed": false,
      "sourcehealth_resolution_mode": "human_only",
      "auto_unblock_allowed": false,
      "extract_fields": ["max_loss", "daily_loss", "dd_type", "add_on_text", "price", "jurisdiction", "payout"],
      "numeric_diff": true,
      "country_set_diff": true,
      "effective_date_required": true,
      "legacy_variant_sensitive": true,
      "crosscheck_source_ids": ["DR05"],
      "expected_language": ["ja"],
      "redirect_policy": "record_final_url_do_not_replace_config",
      "parser_profile": "hantec_instant_lite_product_jp_v1",